{
  "format_version": 1,
  "kind": "evidence",
  "id": "mosaico-rom-readback",
  "target_id": "esp-mosaico",
  "recorded_at": "2026-10-30",
  "layer": "physical",
  "result": "pass",
  "hardware": {
    "revision": "1.2",
    "carrier_id": null,
    "carrier_revision": null,
    "variant": "Assembled kit; V1.2 reported by operator; ESP32-S31 silicon revision 0.0 read by esptool"
  },
  "inputs": [
    {
      "name": "Vendor application screen labels reported before ROM entry",
      "revision": "Software 0.4.0; GSP 1.5.1",
      "sha256": null,
      "reference": null
    },
    {
      "name": "Official esptool standalone macOS arm64 archive",
      "revision": "5.6.0",
      "sha256": "08a58829a3f14bb08f2e39f4cad48dcb14b7000384268e7f06689836332d6e25",
      "reference": null
    }
  ],
  "scenario": "Enter ROM Download Mode with BOOT held at power-on. Read chip/security information and NOR identity without a stub. Read the complete NOR using the official RAM stub. After manual ROM re-entry, verify the saved file against flash using ROM verify-flash. Parse the ESP-IDF partition table and check its MD5. No flash/eFuse write or erase command was issued.",
  "expected": "USB ROM access, a complete private NOR backup matching the device, and an internally consistent installed partition table.",
  "observed": "USB enumerated as ESP32-S31 with a CDC serial port on macOS arm64. Chip revision 0.0, 40 MHz crystal, USB-OTG mode; NOR JEDEC manufacturer 0xc8, device 0x4018, detected 16 MB. Secure Boot and Flash Encryption disabled on this sample. Read 16777216 bytes; ROM verify-flash reported a matching digest. Partition table at 0x9000 has a valid MD5 and nvs, otadata, phy_init, factory, ui_apps and system entries; no vibe_mode or OTA app slot.",
  "duration_seconds": null,
  "measurements": [
    {
      "name": "nor-backup-size",
      "value": 16777216,
      "unit": "byte"
    },
    {
      "name": "nor-read-duration",
      "value": 332.7,
      "unit": "s"
    },
    {
      "name": "partition-table-offset",
      "value": 36864,
      "unit": "byte"
    },
    {
      "name": "partition-entries",
      "value": 6,
      "unit": "entry"
    }
  ],
  "limits": [
    "This establishes vendor ROM access and NOR backup verification, not EmberBSD boot, an installed image or a tested restore.",
    "The board revision is an operator report; silicon revision is separate. BaseBoard marking was not independently read.",
    "NOR contents and device identifiers are private and are not attached. The separate NAND, eFuses and off-device data are not covered by this backup.",
    "Security settings and partition offsets apply to the observed firmware/sample, not every Mosaico or software release.",
    "The USB device disappeared after the stub read; cause was not established. Manual ROM re-entry restored access and ROM verification succeeded.",
    "RAM-only OS boot and the vendor Vibe update path were not exercised."
  ],
  "source_refs": [
    "mosaico-hardware-v12",
    "esptool-5-6-0-macos-arm64"
  ]
}
